{
  "schemaVersion": "hcd-patch/1",
  "documentId": "doc-1d648051f63488279b928e02ba17e456",
  "patchId": "hdoc-example-mask-1",
  "baseRevision": 0,
  "operations": [
    {
      "op": "text.splice",
      "nodeId": "n_6c85776df820438bb2333f995e85d55c",
      "start": 12,
      "deleteCount": 3,
      "insertText": "***",
      "precondition": {
        "nodeHash": "41427fc525be646b8c2ebf5d9b500291fe6a90e6cb4c5002e43c9034e15eb691"
      }
    }
  ]
}
